{"run":45,"commit":"a70b541","metric":19.715,"metrics":{"live_recalc_ms":14.268542},"status":"keep","description":"perf: Compact PI contribution rows into typed entries\n\nPurpose: Reduce PI cache decoding and repeated row normalization while preserving append-resume behavior.\n\nIncludes:\n- serialize PI usage and activity rows as positional entries with legacy dictionary migration\n- hydrate typed row tuples for the unchanged-file collection path\n- convert tuples back to mutable indexed rows only while parsing appended events\n- preserve native costs, signatures, offsets, session activity, and full-reparse equivalence","timestamp":1783888780657,"segment":16,"confidence":4.299575347943131,"asi":{"hypothesis":"PI cache rows repeat field names and perform dictionary validation on every recalc; typed positional rows should reduce disk size, cold hydration, and cache-hit collection while retaining mutable append parsing.","correctness_evidence":"Typed rows matched legacy live output exactly, append-resume matched a clean full parse, persistent serialization round-tripped exactly, and all 41 tests plus backpressure checks passed under both system and development Python.","result_interpretation":"Cold median improved from the persisted 20.046 ms best to 19.715 ms (1.7%), and warm median improved from 14.855 ms to 14.269 ms (3.9%). The cache shrank by about 25 KB, cold hydration improved by about 0.09 ms, and isolated PI collection improved from about 1.92 ms to 1.79 ms.","benchmark_integrity":"Every PI file and row is still discovered, stat-validated, natively priced, and aggregated. Append-only growth still validates boundary signatures and resumes from the prior offset; only the stable row representation changed."}}
{"run":46,"commit":"4a48ab3","metric":19.138208,"metrics":{"live_recalc_ms":14.215},"status":"keep","description":"perf: Clone first provider totals without rounded merges\n\nPurpose: Avoid empty-object merge overhead for provider buckets that do not overlap.\n\nIncludes:\n- directly clone first-seen daily, breakdown, attribution, and activity totals\n- retain rounded merge behavior only for true cross-provider overlaps\n- preserve complete object independence between source and combined totals\n- validate exact live payload equivalence, all 41 tests, and autoresearch checks","timestamp":1783889049444,"segment":16,"confidence":3.888302513874565,"asi":{"hypothesis":"Most combined keys belong to one provider, so cloning the first complete bucket directly should avoid redundant method calls and cost rounding while preserving independent combined objects.","correctness_evidence":"Direct clones matched existing combined totals exactly, source and combined daily/nested/activity objects remained independent, the complete live payload matched HEAD exactly at a fixed clock, and all 41 tests plus backpressure checks passed.","result_interpretation":"Cold median improved from the persisted 19.715 ms best to 19.138 ms (2.9%), while warm median held effectively flat at 14.215 ms versus 14.269 ms. Isolated daily plus activity combination improved from about 1.56 ms to 0.69 ms.","benchmark_integrity":"Every provider daily, breakdown, attribution, and activity bucket is still copied into an independent combined structure; all overlapping keys still use the original rounded merge semantics. No provider data or output row is omitted."}}
{"run":47,"commit":"edc991d","metric":18.88025,"metrics":{"live_recalc_ms":13.380291},"status":"keep","description":"perf: Aggregate Codex costs as integer nanodollars\n\nPurpose: Remove repeated floating-point rounding from cached Codex contribution aggregation.\n\nIncludes:\n- persist explicitly marked integer-nanodollar Codex cost fields with legacy float migration\n- accumulate daily, model, and activity costs as exact integers\n- convert completed buckets back to USD before shared aggregation and rendering\n- preserve pricing invalidation, sessions, tokens, cost completeness, and exact payload values","timestamp":1783889433394,"segment":16,"confidence":3.7572872030894584,"asi":{"hypothesis":"Cached Codex costs are already rounded to nine decimals, so integer nanodollar accumulation can replace thousands of float-round calls while preserving exact values for built-in and custom pricing.","correctness_evidence":"200,000 randomized nine-decimal costs round-tripped exactly through nanodollars, the migrated live cache produced a byte-identical fixed-clock payload versus HEAD, and all 41 tests plus backpressure checks passed under system and development Python.","result_interpretation":"Cold median improved from the persisted 19.138 ms best to 18.880 ms (1.3%), and warm median improved from 14.215 ms to 13.380 ms (5.9%). Isolated Codex collection improved from about 3.46 ms to 2.84 ms.","benchmark_integrity":"Every Codex contribution is still discovered, stat-validated, pricing-key validated, and aggregated. Costs retain full nine-decimal precision and are converted back to USD before any cross-provider logic or output generation.","tradeoff_note":"The explicit format marker and integer costs increase the cache by about 5 KB, offset by lower aggregation CPU."}}
{"run":48,"commit":"b0d954b","metric":18.298458,"metrics":{"live_recalc_ms":13.591167},"status":"keep","description":"perf: Normalize Codex cache metadata once\n\nPurpose: Avoid reconstructing invariant dates, hours, and pricing keys for every cached Codex file.\n\nIncludes:\n- persist distinct usage date, activity date, and activity hour as compact ordinal fields\n- compute the pricing cache key once per Codex collection\n- migrate prior nanodollar and legacy float contribution formats\n- preserve session fallback, pricing invalidation, activity bucketing, and exact payload values","timestamp":1783889842902,"segment":16,"confidence":3.483227852296107,"asi":{"hypothesis":"Codex aggregation only consumes usage date plus activity date/hour, and all files share one pricing key; normalizing those invariants once should remove repeated parsing and string construction while shrinking cold JSON.","correctness_evidence":"Prior nanodollar and current temporal formats hydrated to identical contributions, a contribution round-trip preserved distinct usage/activity dates, the complete fixed-clock live payload matched HEAD exactly, and all 41 tests plus backpressure checks passed.","result_interpretation":"Cold median improved from the persisted 18.880 ms best to 18.298 ms (3.1%). Warm median measured 13.591 ms versus 13.380 ms, a small 1.6% shift within run variance. Isolated Codex collection improved from about 2.84 ms to 2.67 ms and the cache shrank by about 19 KB.","benchmark_integrity":"Every Codex file remains stat-validated and pricing-key validated. Separate usage and activity dates are preserved exactly; only unused timestamp precision and repeated invariant key construction are removed."}}
{"run":49,"commit":"ab952c4","metric":18.23925,"metrics":{"live_recalc_ms":12.04275},"status":"keep","description":"perf: Preprice PI native costs as nanodollars\n\nPurpose: Avoid repeated native-cost normalization and floating-point rounding for stable PI contribution rows.\n\nIncludes:\n- persist compact raw native components alongside exact integer-nanodollar costs\n- aggregate native PI costs directly while retaining derived-pricing fallback behavior\n- reconstruct mutable raw costs when append-only sessions resume parsing\n- preserve native totals, signatures, offsets, cost completeness, and full-parse equivalence","timestamp":1783890293600,"segment":16,"confidence":4.081539896956016,"asi":{"hypothesis":"Stable PI rows already contain provider-native costs, so persisting their exact nanodollar breakdown can remove repeated cost objects and rounding while raw components remain available for append-resume updates.","correctness_evidence":"Raw tuple pricing matched the prior dictionary path, prepriced rows matched the complete fixed-clock live payload exactly, append-resume matched a clean full parse, persistence round-tripped, and all 41 tests plus backpressure checks passed.","result_interpretation":"Cold median improved slightly from the persisted 18.298 ms best to 18.239 ms (0.3%), while warm median improved from 13.591 ms to 12.043 ms (11.4%). Isolated PI collection improved from about 1.79 ms to 1.14 ms, and the raw-plus-prepriced cache stayed roughly size-neutral.","benchmark_integrity":"Every PI row and raw native-cost component remains persisted, stat-validated, and aggregated. Non-native rows still use the original catalog pricing path before exact nanodollar accumulation; no parsing or pricing input is skipped."}}
{"run":50,"commit":"af2d72a","metric":18.298958,"metrics":{"live_recalc_ms":12.845792},"status":"discard","description":"perf: discard date-only Claude attribution cache entries after end-to-end regression","timestamp":1783890539937,"segment":16,"confidence":3.74859117712615,"asi":{"hypothesis":"Attribution grouping only consumes local dates, so replacing 790 full timestamps with date ordinals should reduce cache size and hydration without changing attribution.","correctness_evidence":"Legacy and ordinal entries round-tripped to identical dates, the cache shrank by about 22 KB, isolated attribution hydration improved by about 0.21 ms, the full live payload matched HEAD exactly, and all 41 tests plus backpressure checks passed.","result_interpretation":"Cold median regressed from the persisted 18.239 ms best to 18.299 ms, and warm median regressed from 12.043 ms to 12.846 ms despite the isolated hydration gain.","rollback_reason":"Both end-to-end metrics worsened, with a material warm regression, so the date-only attribution representation is not retained.","next_action_hint":"Do not retry attribution date compaction immediately; prioritize higher-leverage render serialization or provider aggregation work with clearer end-to-end evidence.","benchmark_integrity":"Full timestamps were still used for source-event parsing and deduplication; only the already-deduplicated cache representation changed, and no attribution event was skipped."}}
{"run":51,"commit":"af2d72a","metric":15.543375,"metrics":{"live_recalc_ms":9.873417},"status":"keep","description":"perf: Persist validated encoded dataset script\n\nPurpose: Avoid repeatedly encoding the unchanged 430 KB browser dataset after provider validation.\n\nIncludes:\n- cache the encoded usage dataset in an atomic parse-cache sidecar\n- reuse only when provider collection reports no changed cache entries\n- key by parse cache, pricing/config metadata, timezone, and relevant source signatures\n- patch generated time per recalc while preserving changed-file rebuild and exact HTML output","timestamp":1783890959564,"segment":16,"confidence":4.400897194133612,"asi":{"hypothesis":"Once every provider file has been stat-validated unchanged, reuse the previously encoded 430 KB browser dataset instead of running the same JSON encoding again.","correctness_evidence":"Fresh and reused live payloads and HTML matched HEAD byte-for-byte at a fixed clock; a temp integration flow proved exact reuse and invalidation after appending a source event; all 41 tests and backpressure checks passed.","result_interpretation":"Cold median improved from 18.239 ms to 15.543 ms (14.8%), and warm median improved from 12.043 ms to 9.873 ms (18.0%). Fresh-process sidecar hits reduced dataset-script work from about 3.9 ms to 0.3-0.4 ms.","benchmark_integrity":"Every provider directory and file is still enumerated or index-validated and stat-validated. Reuse is forbidden whenever parsing, migration, pruning, or file discovery dirties the provider cache; changed data is fully aggregated and encoded normally.","invalidation_key":"The sidecar key covers the saved parse-cache size/mtime, pricing file, provider paths and availability, pricing metadata, timezone, dataset schema, and relevant backend source signatures.","tradeoff_note":"Adds an approximately 424 KB raw script sidecar to save repeated JSON encoding; writes are atomic and cache read/write failures fall back to normal encoding."}}
