{"type":"config","name":"Reduce live dashboard refresh latency to 200 ms","metricName":"live_recalc_ms","metricUnit":"ms","bestDirection":"lower"}
{"run":1,"commit":"e3824ec","metric":5438.709583,"metrics":{},"status":"keep","description":"baseline for live real-data recalc target using tmp/autoresearch.runtime.html and full unit-test checks; median live /recalc is ~5.44 s with Codex and PI collection dominating","timestamp":1773849799167,"segment":0}
{"run":2,"commit":"e3824ec","metric":1318.534792,"metrics":{},"status":"keep","description":"perf: cache codex session parses by file metadata","timestamp":1773849950149,"segment":0}
{"run":3,"commit":"e3824ec","metric":157.137708,"metrics":{},"status":"keep","description":"perf: cache unchanged provider log parses\n\nPurpose: Reduce repeated live /recalc latency on real local data by reusing parsed results for unchanged Codex, Claude, and PI log files in the long-lived server process.\n\nIncludes:\n- add live-data autoresearch harness and checks writing runtime HTML to tmp/\n- cache Codex session parse results by file size and mtime\n- cache PI session message records by file size and mtime\n- cache Claude request records by file size and mtime\n- update autoresearch notes and ideas backlog","timestamp":1773850467579,"segment":0}
{"type":"config","name":"Reduce live dashboard cold-start recalc latency","metricName":"cold_recalc_ms","metricUnit":"ms","bestDirection":"lower"}
{"run":4,"commit":"9f7f143","metric":5461.125625,"metrics":{},"status":"keep","description":"perf: baseline cold-start recalc latency after warm-cache wins","timestamp":1773851928082,"segment":1}
{"type":"config","name":"Reduce live dashboard restart cold-start recalc latency","metricName":"cold_recalc_ms","metricUnit":"ms","bestDirection":"lower"}
{"run":5,"commit":"9f7f143","metric":221.2255,"metrics":{},"status":"keep","description":"perf: persist provider parse caches across restarts","timestamp":1773852263910,"segment":2}
{"run":6,"commit":"9f7f143","metric":65.441125,"metrics":{},"status":"keep","description":"perf: cache cold-start provider contributions more aggressively","timestamp":1773852672336,"segment":2}
{"run":7,"commit":"9f7f143","metric":66.135625,"metrics":{},"status":"discard","description":"perf: reuse file stat results from directory iteration to avoid redundant stat calls; warm improved slightly but cold median regressed versus 65.44 ms best","timestamp":1773853061733,"segment":2}
{"run":8,"commit":"9f7f143","metric":65.812583,"metrics":{},"status":"discard","description":"perf: lazily export dashboard_core package symbols to cut import overhead; import time dropped materially but cold median still regressed slightly versus 65.44 ms best","timestamp":1773853127084,"segment":2}
{"run":9,"commit":"9f7f143","metric":60.633166,"metrics":{},"status":"keep","description":"perf: cache priced codex file contributions for cold-start rebuilds","timestamp":1773853405512,"segment":2}
{"run":10,"commit":"9f7f143","metric":74.567333,"metrics":{},"status":"discard","description":"perf: cache priced Claude file contributions for cold-start rebuilds; extra serialized contribution shape increased cold latency and regressed well past the 60.63 ms best","timestamp":1773853601729,"segment":2}
{"run":11,"commit":"9f7f143","metric":62.329,"metrics":{},"status":"discard","description":"perf: cache priced PI file contributions for cold-start rebuilds; warm improved slightly but cold median remained worse than the 60.63 ms best","timestamp":1773853774217,"segment":2}
{"run":12,"commit":"9f7f143","metric":0,"metrics":{},"status":"crash","description":"perf: switch persistent cache serialization to pickle-backed binary format; benchmark crashed because the pickle import was missing","timestamp":1773853982961,"segment":2}
{"run":13,"commit":"9f7f143","metric":0,"metrics":{},"status":"crash","description":"perf: switch persistent cache serialization to pickle-backed binary format; fresh-process benchmark crashed because the persistent cache magic constant was missing","timestamp":1773854085014,"segment":2}
{"run":14,"commit":"9f7f143","metric":61.99725,"metrics":{},"status":"discard","description":"perf: switch persistent cache serialization to pickle-backed binary format; restart cold latency stayed worse than the 60.63 ms best despite a smaller faster-loading cache blob","timestamp":1773854145583,"segment":2}
{"run":15,"commit":"9f7f143","metric":67.218333,"metrics":{},"status":"discard","description":"perf: cache Codex aggregate daily/activity totals across restarts; warm improved slightly but cold median regressed versus the 60.63 ms best","timestamp":1773854493439,"segment":2}
{"run":16,"commit":"c0dbb1f","metric":67.05425,"metrics":{},"status":"discard","description":"Measured current live-data restart-cold benchmark while investigating the user's slow browser refresh report; current daemon-side recalc remains fast (~67.1 ms cold, ~45.5 ms warm), so the intermittent multi-second refresh is not reproduced in the benchmark.","timestamp":1776269051238,"segment":2,"confidence":65.6908964883349,"iterationTokens":null}
{"type":"config","name":"Reduce PI append-triggered refresh latency","metricName":"pi_append_parse_ms","metricUnit":"ms","bestDirection":"lower"}
{"run":17,"commit":"c0dbb1f","metric":3380.897375,"metrics":{},"status":"keep","description":"baseline: benchmark PI append-triggered cache invalidation by appending valid usage events to a temp copy of the 925 MiB live PI session; each append currently forces a full reparse at ~3381 ms median","timestamp":1776270594900,"segment":3,"confidence":null,"iterationTokens":5771}
{"run":18,"commit":"c0dbb1f","metric":0.357167,"metrics":{},"status":"keep","description":"perf: resume PI session parsing from the last verified byte offset when a log grows append-only; store verified head/boundary signatures plus parser state in the persistent PI cache so appends to the 925 MiB session no longer trigger a full reparse (~3380.9 ms -> ~0.36 ms median)","timestamp":1776270813096,"segment":3,"confidence":null,"iterationTokens":15084}
{"type":"config","name":"Parallel provider collection for live dashboard recalc","metricName":"cold_recalc_ms","metricUnit":"ms","bestDirection":"lower"}
{"run":19,"commit":"71099da","metric":134.193959,"metrics":{},"status":"keep","description":"baseline: current sequential provider collection after timing diagnostics work; cold live recalc is ~134.2 ms median and warm is ~55.8 ms before testing provider-level parallelism","timestamp":1776288682160,"segment":4,"confidence":null,"iterationTokens":103}
{"run":20,"commit":"71099da","metric":70.100542,"metrics":{},"status":"keep","description":"perf: collect Codex, Claude, and PI usage in parallel after loading persistent caches and before saving them; cold live recalc improved from ~134.2 ms to ~70.1 ms median while warm also edged down to ~52.4 ms","timestamp":1776288724614,"segment":4,"confidence":null,"iterationTokens":1901}
{"type":"config","name":"Preserve complete tmux usage status","metricName":"required_fields","metricUnit":"","bestDirection":"higher"}
{"run":21,"commit":"9d60a83","metric":0,"metrics":{},"status":"crash","description":"Attempted a screenshot-information baseline, but the autoresearch harness requires the repository entrypoint.","timestamp":1783882398793,"segment":5,"confidence":null,"asi":{"hypothesis":"The existing 96-column tmux output covers every screenshot field except the five-hour quota.","rollback_reason":"The experiment command was rejected before execution because autoresearch.sh is mandatory.","next_action_hint":"Use the repository autoresearch entrypoint for benchmark runs and validate tmux field coverage through targeted QA outside run_experiment."}}
{"type":"config","name":"Cold dashboard recalc after daemon restart","metricName":"cold_recalc_ms","metricUnit":"ms","bestDirection":"lower"}
{"run":22,"commit":"9d60a83","metric":54.375334,"metrics":{"live_recalc_ms":41.414292},"status":"keep","description":"Establish cold-recalc baseline before the tmux quota correctness fix.","timestamp":1783882456830,"segment":6,"confidence":null,"asi":{"hypothesis":"Capture the current cold and warm recalc latency so the quota-display fix can be checked for regressions."}}
{"run":23,"commit":"9d60a83","metric":54.510875,"metrics":{"live_recalc_ms":41.057333},"status":"discard","description":"tmux: preserve inactive five-hour quota without recalc regressions","timestamp":1783882712706,"segment":6,"confidence":null,"asi":{"hypothesis":"Reconcile a backend-omitted inactive five-hour quota and add an all-information compact render tier without affecting the recalc pipeline.","rollback_reason":"The unrelated cold-recalc median was 0.136 ms slower than baseline, within likely noise but not a primary-metric improvement.","next_action_hint":"Reapply the correctness patch unchanged and rerun to distinguish benchmark noise from a real regression; the tmux code is outside the measured recalc path.","correctness_evidence":"Targeted live output contained 5h, weekly reset, Today, MTD, cost, and refresh interval within 96 columns; 41 tests passed."}}
{"run":24,"commit":"9d60a83","metric":53.528916,"metrics":{"live_recalc_ms":41.388708},"status":"keep","description":"tmux: Preserve inactive five-hour quota\n\nPurpose: Keep the five-hour ChatGPT quota visible when Codex omits a fully reset inactive window.\n\nIncludes:\n- reconcile standard five-hour and weekly windows without replacing active quota observations\n- prefer compact quota labels before dropping Today, MTD, cost, or refresh timing\n- invalidate legacy quota snapshots and document the fallback behavior\n- validate live output and all 41 unit tests","timestamp":1783882744354,"segment":6,"confidence":6.244737754627918,"asi":{"hypothesis":"The quota reconciliation and compact render tier restore the missing five-hour information while leaving the measured recalc path unchanged.","correctness_evidence":"Live output rendered 5h 100%, 7d 91% with reset, Today 77.4M, MTD 1.07B, $857, and 11:57 to 12:00 within 96 columns; full backpressure checks passed.","performance_interpretation":"The 0.846 ms cold improvement is likely benchmark noise because the changed tmux modules are outside the recalc path; the important result is no observed regression."}}
{"type":"config","name":"Cold dashboard recalc after daemon restart","metricName":"cold_recalc_ms","metricUnit":"ms","bestDirection":"lower"}
{"run":25,"commit":"6422938","metric":46.587708,"metrics":{"live_recalc_ms":33.084417},"status":"keep","description":"perf: Splice dynamic dashboard regions in one pass\n\nPurpose: Reduce cold and warm recalc latency by replacing repeated full-HTML regex rewrites with one ID-anchored splice pass.\n\nIncludes:\n- locate the five dynamic dashboard elements by stable IDs\n- rebuild the HTML once for the common path while retaining regex compatibility fallbacks\n- preserve byte-for-byte output equivalence for the live template\n- validate all 41 unit tests and autoresearch backpressure checks","timestamp":1783883076158,"segment":7,"confidence":null,"asi":{"hypothesis":"Repeated DOTALL regex substitutions and full-string copies account for much of the remaining render cost; one ID-anchored splice pass should reduce real recalc latency without skipping any rendering or collection work.","correctness_evidence":"The fast path produced byte-for-byte identical output to the prior regex pipeline on the live runtime HTML; all 41 unit tests and backpressure checks passed.","result_interpretation":"Cold median improved from the persisted 53.529 ms best to 46.588 ms (13.0%), while warm median improved from 41.389 ms to 33.084 ms (20.1%).","benchmark_integrity":"The change performs every existing dynamic replacement and retains the original regex fallback for legacy templates; no data collection, parsing, or payload work was skipped."}}
{"type":"config","name":"Cold dashboard recalc after daemon restart","metricName":"cold_recalc_ms","metricUnit":"ms","bestDirection":"lower"}
{"run":26,"commit":"6db851e","metric":45.1315,"metrics":{"live_recalc_ms":35.780708},"status":"keep","description":"perf: Deserialize persistent cache entries in place\n\nPurpose: Reduce cold-start cache hydration overhead without changing cache validity or provider parsing behavior.\n\nIncludes:\n- reuse cache-owned dictionaries produced by JSON decoding instead of cloning each record\n- preserve serialized timezone offsets without redundant local timezone conversion\n- retain the existing cache format, signatures, and invalidation rules\n- validate timestamp equivalence, all 41 unit tests, and autoresearch checks","timestamp":1783883418286,"segment":8,"confidence":null,"asi":{"hypothesis":"Fresh JSON decoding already owns every cache object, so cloning thousands of records and converting already-local timestamp offsets is redundant cold-start work.","correctness_evidence":"All 3,642 cached timestamps matched the prior local ISO representation exactly; all 41 unit tests and backpressure checks passed.","result_interpretation":"Cold median improved from the persisted 46.588 ms best to 45.132 ms (3.1%). Warm moved from 33.084 ms to 35.781 ms, likely run noise because cache hydration is bypassed after the first in-process load; it remains far below the 200 ms target.","benchmark_integrity":"The persistent cache format, file signatures, invalidation checks, provider scans, parsing, aggregation, and rendered payload remain unchanged; only redundant cache object reconstruction was removed."}}
{"type":"config","name":"Cold dashboard recalc after daemon restart","metricName":"cold_recalc_ms","metricUnit":"ms","bestDirection":"lower"}
{"run":27,"commit":"7546b53","metric":43.063625,"metrics":{"live_recalc_ms":37.067708},"status":"keep","description":"perf: Prune deleted files from persistent caches\n\nPurpose: Reduce cold cache loading by removing records whose source files no longer exist under each fully scanned provider root.\n\nIncludes:\n- track live cache keys during complete Codex, Claude, and PI scans\n- prune only stale entries belonging to the scanned provider root\n- shrink the live cache from 1.52 MB to 0.79 MB\n- validate root isolation, all 41 unit tests, and autoresearch checks","timestamp":1783883692626,"segment":9,"confidence":null,"asi":{"hypothesis":"Persistent cache entries for deleted sessions are loaded and deserialized forever; pruning them after the existing complete provider scans should reduce cold starts without excluding any live source file.","correctness_evidence":"The live cache retained all 706 Codex, 40 Claude, 40 Claude-attribution, and 134 PI files while shrinking from 1,523,484 to 791,650 bytes; root-isolation QA, all 41 tests, and backpressure checks passed.","result_interpretation":"Cold median improved from the persisted 45.132 ms best to 43.064 ms (4.6%). Warm moved from 35.781 ms to 37.068 ms; the small live-key tracking overhead remains far below the 200 ms target and is secondary to the cold improvement.","benchmark_integrity":"Every provider root is still fully enumerated and every live file retains the same stat, invalidation, parse, aggregation, and rendering path; only cache entries for absent files are removed."}}
{"type":"config","name":"Cold dashboard recalc after daemon restart","metricName":"cold_recalc_ms","metricUnit":"ms","bestDirection":"lower"}
{"run":28,"commit":"06755e3","metric":34.950083,"metrics":{"live_recalc_ms":29.0965},"status":"keep","description":"perf: Reuse directory-validated session file indexes\n\nPurpose: Avoid repeated directory enumeration while preserving complete discovery and per-file invalidation on cold and warm recalculations.\n\nIncludes:\n- persist each provider root's ordered JSONL file list and directory mtimes\n- reuse the list only after validating every scanned directory's mtime\n- trigger a stable full rescan whenever a directory changes or disappears\n- validate ordering, add/delete/content-change behavior, all 41 tests, and autoresearch checks","timestamp":1783883975587,"segment":10,"confidence":null,"asi":{"hypothesis":"Provider session file names change far less often than file contents, so a persisted list can avoid repeated directory scans when every previously scanned directory mtime is unchanged; existing per-file size and mtime checks still detect content changes.","correctness_evidence":"The index preserved exact legacy traversal order on all live roots, reused safely after content-only changes, rebuilt after file additions and deletions, survived persistence reload, and passed all 41 tests plus backpressure checks.","result_interpretation":"Cold median improved from the persisted 43.064 ms best to 34.950 ms (18.8%), while warm median improved from 37.068 ms to 29.097 ms (21.5%).","benchmark_integrity":"Every indexed directory is stat-validated before reuse and every listed file still receives its existing size/mtime validation; any directory metadata change forces the original complete scan, so no source discovery or parsing work is silently skipped."}}
{"type":"config","name":"Cold dashboard recalc after daemon restart","metricName":"cold_recalc_ms","metricUnit":"ms","bestDirection":"lower"}
{"run":29,"commit":"30379f9","metric":30.981,"metrics":{"live_recalc_ms":24.66675},"status":"keep","description":"perf: Keep indexed session paths as strings\n\nPurpose: Remove repeated Path construction from unchanged-file cache hits while preserving the same signature and parsing behavior.\n\nIncludes:\n- yield persisted file-index paths directly as strings\n- use os.stat and os.fspath for cache lookup and validation\n- construct Path objects only when a changed file requires parsing\n- validate string and Path equivalence, all 41 tests, and autoresearch checks","timestamp":1783884288601,"segment":11,"confidence":null,"asi":{"hypothesis":"The persisted file index already contains normalized path strings, so rebuilding hundreds of Path objects on every scan is redundant; unchanged cache hits can stay string-native and convert only on a real parse.","correctness_evidence":"Codex, Claude request, Claude attribution, and PI cache hits returned identical results for string and Path inputs; all 41 unit tests and backpressure checks passed.","result_interpretation":"Cold median improved from the persisted 34.950 ms best to 30.981 ms (11.4%), while warm median improved from 29.097 ms to 24.667 ms (15.2%).","benchmark_integrity":"Every indexed path still receives os.stat size/mtime validation, and changed or append-growing files are converted to Path before the unchanged parser and signature logic runs; no file or parsing work is skipped."}}
{"type":"config","name":"Cold dashboard recalc after daemon restart","metricName":"cold_recalc_ms","metricUnit":"ms","bestDirection":"lower"}
{"run":30,"commit":"b8dcab0","metric":30.961583,"metrics":{"live_recalc_ms":25.452459},"status":"keep","description":"perf: Evaluate session ID path fallbacks lazily\n\nPurpose: Avoid computing file stems for valid cached session IDs while preserving malformed-record fallback behavior.\n\nIncludes:\n- normalize cached session IDs before evaluating path-derived fallbacks\n- defer PI path stems on valid stat and cache-hit paths\n- preserve fallback IDs for blank or missing session metadata\n- validate lazy behavior, all 41 tests, and autoresearch checks","timestamp":1783884542825,"segment":12,"confidence":null,"asi":{"hypothesis":"All live cached records contain session IDs, but path-derived fallbacks are evaluated eagerly; making the fallback lazy should remove unnecessary basename work without changing malformed-record handling.","correctness_evidence":"All live providers completed with path-stem evaluation configured to fail, proving valid cache records never need the fallback; explicit blank-ID fallback QA, all 41 tests, and backpressure checks passed.","result_interpretation":"Cold median moved from 30.981 ms to 30.962 ms (0.06% improvement), which is far inside observed run noise; warm moved to 25.452 ms. A confirmation run is required before treating this as a real keep.","benchmark_integrity":"Every source file, signature check, cache lookup, parse, and aggregation remains unchanged; only evaluation timing of an existing fallback was changed."}}
{"run":31,"commit":"b8dcab0","metric":31.907708,"metrics":{"live_recalc_ms":24.740959},"status":"discard","description":"perf: discard lazy session ID path fallback after confirmation","timestamp":1783884559482,"segment":12,"confidence":null,"asi":{"hypothesis":"Reconfirm whether deferring path-stem fallbacks for valid cached session IDs produces a measurable cold-start improvement.","rollback_reason":"The confirmation cold median regressed to 31.908 ms versus the persisted 30.981 ms best, showing the initial 0.02 ms apparent gain was benchmark noise.","next_action_hint":"Return to higher-leverage work such as reducing aggregation round operations or compacting the remaining 0.8 MB JSON cache; do not retry this micro-optimization.","correctness_evidence":"The implementation remained correct across lazy-fallback QA, 41 tests, and backpressure checks, but did not improve the primary metric reliably."}}
{"type":"config","name":"Cold dashboard recalc after daemon restart","metricName":"cold_recalc_ms","metricUnit":"ms","bestDirection":"lower"}
