{"run":32,"commit":"b8dcab0","metric":29.935542,"metrics":{"live_recalc_ms":24.67375},"status":"keep","description":"perf: Compact Codex contributions into positional cache entries\n\nPurpose: Reduce cold cache decoding and Codex aggregation overhead without changing contribution values, signatures, or pricing behavior.\n\nIncludes:\n- migrate legacy Codex cache dictionaries to backward-compatible positional entries\n- unpack normalized contribution tuples directly in the Codex aggregation loop\n- reduce the Codex cache section from 386 KB to 229 KB\n- validate exact live payload equivalence, all 41 tests, and autoresearch checks","timestamp":1783885169384,"segment":13,"confidence":null,"asi":{"hypothesis":"Repeated Codex cache field names and dictionary lookups add avoidable JSON size and aggregation overhead; positional entries can preserve identical values while reducing both.","correctness_evidence":"Legacy-to-positional round trips preserved every contribution, the compact cache reloaded all 706 entries, the full live payload matched HEAD byte-for-byte at a fixed clock, and all 41 tests plus backpressure checks passed.","result_interpretation":"Cold median improved from the persisted 30.981 ms best to 29.936 ms (3.4%). Warm held effectively flat at 24.674 ms versus 24.667 ms.","benchmark_integrity":"All file indexes, stat signatures, pricing keys, contributions, parsing fallbacks, aggregation, and rendered payloads remain intact; only the internal persisted representation and cache-hit access shape changed."}}
{"type":"config","name":"Cold dashboard recalc after daemon restart","metricName":"cold_recalc_ms","metricUnit":"ms","bestDirection":"lower"}
{"run":33,"commit":"32e31ea","metric":31.489209,"metrics":{"live_recalc_ms":24.476667},"status":"discard","description":"perf: discard integer-nanodollar rounding fast path","timestamp":1783885388150,"segment":14,"confidence":null,"asi":{"hypothesis":"Most aggregation inputs are already rounded to nanodollars, so a conservative integer fast path far from rounding boundaries should reduce repeated Python round calls while preserving exact values.","rollback_reason":"Cold median regressed from the persisted 29.936 ms best to 31.489 ms despite exact output equivalence; branch checks and extra arithmetic outweighed any faster rounded-value cases.","next_action_hint":"Do not revisit round_cost micro-optimizations; focus on data-shape reductions such as compact Claude/PI cache entries or larger aggregation changes with measurable leverage.","correctness_evidence":"The implementation matched Python rounding across 1,500,003 randomized and boundary-focused values, produced an exact live payload match, and passed all 41 tests plus backpressure checks."}}
{"type":"config","name":"Cold dashboard recalc after daemon restart","metricName":"cold_recalc_ms","metricUnit":"ms","bestDirection":"lower"}
{"run":34,"commit":"32e31ea","metric":28.666125,"metrics":{"live_recalc_ms":22.20875},"status":"keep","description":"perf: Batch Codex aggregation before cost rounding\n\nPurpose: Reduce repeated model updates and nanodollar rounding while preserving complete per-session Codex aggregation.\n\nIncludes:\n- accumulate every Codex contribution directly into daily, model, and activity buckets\n- round each completed cost bucket once instead of after every contribution\n- preserve unique session counts, token totals, pricing completeness, and activity hours\n- validate exact live payload equivalence, all 41 tests, and autoresearch checks","timestamp":1783885709724,"segment":15,"confidence":null,"asi":{"hypothesis":"Codex contributions are already individually priced to nanodollar precision, so accumulating every contribution before final bucket rounding should preserve output while removing thousands of repeated method and round calls.","correctness_evidence":"The batched collector produced an exact full live payload match against HEAD at a fixed clock, retained all session/model/activity semantics, and passed all 41 tests plus backpressure checks.","result_interpretation":"Cold median improved from the persisted 29.936 ms best to 28.666 ms (4.2%), while warm median improved from 24.674 ms to 22.209 ms (10.0%).","benchmark_integrity":"Every Codex file is still discovered, stat-validated, parsed or cache-read, priced, and included; only the timing of mathematically equivalent bucket accumulation and final nine-decimal rounding changed."}}
{"type":"config","name":"Cold dashboard recalc after daemon restart","metricName":"cold_recalc_ms","metricUnit":"ms","bestDirection":"lower"}
{"run":35,"commit":"780e12b","metric":27.75825,"metrics":{"live_recalc_ms":23.401417},"status":"keep","description":"perf: Batch Claude aggregation before cost rounding\n\nPurpose: Reduce repeated daily and model-bucket rounding while preserving Claude request deduplication and attribution behavior.\n\nIncludes:\n- accumulate every deduplicated Claude request directly into daily and model buckets\n- round each completed cost bucket once after attribution processing\n- preserve session activity, context attribution shares, pricing, and unique session counts\n- validate exact live payload equivalence, all 41 tests, and autoresearch checks","timestamp":1783885891688,"segment":16,"confidence":null,"asi":{"hypothesis":"Claude requests are individually priced before aggregation, so batching daily and model totals can remove thousands of repeated method and rounding calls while leaving deduplication, attribution, and activity semantics unchanged.","correctness_evidence":"The batched Claude collector produced an exact full live payload match against HEAD at a fixed clock and passed all 41 tests plus backpressure checks.","result_interpretation":"Cold median improved from the persisted 28.666 ms best to 27.758 ms (3.2%). Warm median measured 23.401 ms versus 22.209 ms, with individual warm runs as low as 21.226 ms; the changed Claude path is faster in isolated profiling and the median shift appears to be run variance.","benchmark_integrity":"Every Claude file and request is still discovered, stat-validated, deduplicated, priced, attributed, and aggregated; only equivalent daily/model accumulation and final nine-decimal rounding timing changed."}}
{"run":36,"commit":"3474b04","metric":26.021458,"metrics":{"live_recalc_ms":20.659125},"status":"keep","description":"perf: Memoize pricing rate resolution per catalog\n\nPurpose: Avoid repeatedly scanning immutable provider rate cards for every usage record of the same model.\n\nIncludes:\n- cache resolved and unmapped rates by provider and model for each catalog instance\n- preserve longest-prefix model matching, native-cost handling, warnings, and per-request pricing\n- keep cache lifetime scoped to the loaded pricing catalog\n- validate exact live payload equivalence, all 41 tests, and autoresearch checks","timestamp":1783886086718,"segment":16,"confidence":null,"asi":{"hypothesis":"A recalc prices hundreds of Claude requests but uses only a few provider/model combinations, so memoizing immutable rate resolution inside the per-recalc catalog should eliminate repeated rule scans and ModelRates construction without skipping any pricing work.","correctness_evidence":"Resolved and unmapped model rates memoized correctly, the complete live payload matched HEAD exactly at a fixed clock, and all 41 tests plus backpressure checks passed.","result_interpretation":"Cold median improved from 27.758 ms to 26.021 ms (6.3%), and warm median improved from 23.401 ms to 20.659 ms (11.7%).","benchmark_integrity":"Every provider record is still discovered, validated, deduplicated, and priced independently; only immutable provider/model rate lookup results are reused within one PricingCatalog instance."}}
{"run":37,"commit":"3b2c663","metric":25.508333,"metrics":{"live_recalc_ms":20.487833},"status":"keep","description":"perf: Compact Claude requests into positional cache entries\n\nPurpose: Reduce cold cache decoding and repeated request-field normalization without changing Claude deduplication or pricing semantics.\n\nIncludes:\n- migrate legacy Claude request dictionaries to backward-compatible positional entries\n- carry validated request tuples through cross-file request deduplication\n- preserve timestamp and token maxima, model selection, session fallback, and pricing\n- shrink the persistent cache by about 82 KB and validate exact live payload equivalence","timestamp":1783886545492,"segment":16,"confidence":4.384734713763714,"asi":{"hypothesis":"Claude request records repeat nine field names hundreds of times and are revalidated after cache hydration; positional typed entries should reduce JSON decoding, object creation, and collector work while preserving every request.","correctness_evidence":"Legacy and compact cache formats both hydrate to the same validated records, all request aggregation tests passed, the complete live payload matched HEAD exactly at a fixed clock, and all 41 tests plus backpressure checks passed.","result_interpretation":"Cold median improved from the persisted 26.021 ms best to 25.508 ms (2.0%), while warm median improved slightly from 20.659 ms to 20.488 ms. The cache shrank from 746,678 to 664,800 bytes and isolated Claude collection fell from about 4.36 ms to 3.81 ms.","benchmark_integrity":"All Claude files are still discovered and stat-validated, every request remains globally deduplicated with identical max-token and latest-timestamp rules, and every resulting request is independently priced; only the internal cache and dedupe representation changed."}}
{"run":38,"commit":"32186b7","metric":24.151166,"metrics":{"live_recalc_ms":18.725333},"status":"keep","description":"perf: Collect optimized providers sequentially\n\nPurpose: Remove thread scheduling and GIL contention now that cache-hit provider aggregation is short and CPU-bound.\n\nIncludes:\n- collect Codex, Claude, and PI in deterministic sequence with the shared pricing catalog\n- retain per-provider and overall collection timing diagnostics\n- preserve complete provider scans, cache validation, aggregation, and output ordering\n- validate exact live payload equivalence, all 41 tests, and autoresearch checks","timestamp":1783886765193,"segment":16,"confidence":3.857241543031778,"asi":{"hypothesis":"After cache and aggregation optimizations, provider collectors are short Python-heavy phases whose threaded execution contends on the GIL; sequential execution should now be faster than ThreadPoolExecutor scheduling while doing identical work.","correctness_evidence":"A 40-round paired live comparison produced identical provider totals and measured 9.374 ms sequential versus 10.448 ms threaded medians; the complete fixed-clock live payload matched HEAD exactly, and all 41 tests plus backpressure checks passed.","result_interpretation":"Cold median improved from the persisted 25.508 ms best to 24.151 ms (5.3%), and warm median improved from 20.488 ms to 18.725 ms (8.6%).","benchmark_integrity":"Codex, Claude, and PI are still fully discovered, stat-validated, parsed or cache-read, priced, and aggregated on every recalc; only their scheduling changed from contended worker threads to deterministic sequential execution.","tradeoff_note":"Provider parallelism was valuable before the collectors were compressed and batched, but paired measurements on the current complete live workload show its scheduling and GIL costs now exceed any I/O overlap."}}
{"run":39,"commit":"1f25e07","metric":24.04925,"metrics":{"live_recalc_ms":18.602583},"status":"keep","description":"perf: Batch PI aggregation before cost rounding\n\nPurpose: Reduce repeated PI model, activity, and nanodollar updates while preserving native-cost and session semantics.\n\nIncludes:\n- accumulate PI usage directly into typed daily, model, and per-session activity buckets\n- merge session activity before rounding completed global buckets once\n- preserve native-cost pricing, unique sessions, activity hours, and pricing completeness\n- validate exact live payload equivalence, all 41 tests, and autoresearch checks","timestamp":1783886964845,"segment":16,"confidence":2.7328987515906285,"asi":{"hypothesis":"PI usage rows are individually priced before aggregation, so typed bucket accumulation and one final rounding pass should remove repeated dictionary normalization and thousands of intermediate rounds without changing results.","correctness_evidence":"A standalone batched implementation matched the current PI daily and activity totals exactly, the production full live payload matched HEAD exactly at a fixed clock, and all 41 tests plus backpressure checks passed.","result_interpretation":"Cold median improved slightly from the persisted 24.151 ms best to 24.049 ms (0.4%), and warm median improved from 18.725 ms to 18.603 ms. Isolated PI collection improved more clearly from about 2.43 ms to 1.92 ms (21%), so the small end-to-end delta is consistent with the optimization being partly masked by run variance.","benchmark_integrity":"Every PI file and contribution is still discovered, stat-validated, parsed or cache-read, natively priced, and included; only equivalent typed accumulation and final nine-decimal rounding timing changed."}}
{"run":40,"commit":"a1b77f0","metric":23.637625,"metrics":{"live_recalc_ms":18.639083},"status":"keep","description":"perf: Skip unused YTD row materialization\n\nPurpose: Avoid serializing and sorting YTD artifacts that the pipeline never reads while preserving every dashboard output.\n\nIncludes:\n- make daily row and ranked-value materialization independently optional with unchanged defaults\n- skip provider YTD rows and rankings when only summaries are consumed\n- retain combined YTD rankings and aggregate breakdowns used by the dashboard tables\n- validate exact live payload equivalence, all 41 tests, and autoresearch checks","timestamp":1783887166302,"segment":16,"confidence":4.178692105498004,"asi":{"hypothesis":"The four YTD passes build nested per-day JSON rows that are discarded immediately; selectively materializing only consumed summaries, combined rankings, and aggregate breakdowns should remove duplicate serialization without omitting output.","correctness_evidence":"YTD materialization time fell from roughly 1.21 ms to 0.65 ms in stable fresh-process diagnostics, the complete live payload matched HEAD exactly at a fixed clock, and all 41 tests plus backpressure checks passed.","result_interpretation":"Cold median improved from the persisted 24.049 ms best to 23.638 ms (1.7%). Warm median was effectively flat at 18.639 ms versus 18.603 ms, within run variance.","benchmark_integrity":"Every YTD date still contributes to provider and combined summaries, all combined days remain ranked for the table, and aggregate breakdowns remain complete; only internal row dictionaries and provider ranking lists proven unused by the pipeline are not constructed."}}
{"run":41,"commit":"4b8f14f","metric":23.145458,"metrics":{"live_recalc_ms":16.968375},"status":"keep","description":"perf: Compact Claude attribution into positional cache entries\n\nPurpose: Reduce cold cache decoding and repeated attribution normalization without changing attribution shares or categories.\n\nIncludes:\n- migrate legacy attribution dictionaries to backward-compatible positional events\n- carry validated category, name, session, and timestamp tuples through grouping\n- preserve event deduplication, session fallback, category counts, and proportional usage shares\n- shrink the persistent cache by about 35 KB and validate exact live payload equivalence","timestamp":1783887330521,"segment":16,"confidence":4.586611620868091,"asi":{"hypothesis":"Claude attribution events repeat four field names hundreds of times and are normalized again during grouping; positional typed events should reduce cache decoding and collector overhead while preserving every event.","correctness_evidence":"Legacy and positional attribution formats hydrate to the same typed events, the complete live payload matched HEAD exactly at a fixed clock, and all 41 tests plus backpressure checks passed.","result_interpretation":"Cold median improved from the persisted 23.638 ms best to 23.145 ms (2.1%), and warm median improved from 18.639 ms to 16.968 ms (9.0%). The cache shrank from 664,793 to 629,743 bytes and isolated Claude collection improved from about 3.75 ms to 3.49 ms.","benchmark_integrity":"Every Claude attribution file is still discovered and stat-validated, all events retain their category, name, session, and timestamp, and the same category-level proportional usage shares are computed; only the internal cache and grouping representation changed."}}
{"run":42,"commit":"1ac37c9","metric":21.0745,"metrics":{"live_recalc_ms":14.673708},"status":"keep","description":"perf: Price exact Claude request groups once\n\nPurpose: Eliminate repeated pricing and bucket updates when grouped request pricing is mathematically identical.\n\nIncludes:\n- group deduplicated Claude requests by date, session, and model before aggregation\n- price a group once only when rates are integer nanodollars per token\n- retain per-request pricing automatically for arbitrary custom rates\n- preserve request maxima, tokens, sessions, attribution activity, warnings, and exact costs","timestamp":1783887734482,"segment":16,"confidence":5.657303073586205,"asi":{"hypothesis":"The live workload has 542 deduplicated Claude requests but only 18 date/session/model groups; for integer-nanodollar token rates, pricing complete groups once is exactly equivalent and removes hundreds of cost objects and bucket updates.","correctness_evidence":"Grouped and per-request costs matched across 8,000 randomized built-in-model cases, a non-integral custom rate correctly selected the per-request fallback, the complete live payload matched HEAD exactly at a fixed clock, and all 41 tests plus backpressure checks passed.","result_interpretation":"Cold median improved from the persisted 23.145 ms best to 21.075 ms (8.9%), and warm median improved from 16.968 ms to 14.674 ms (13.5%). Isolated Claude collection fell from about 3.49 ms to 1.01 ms.","benchmark_integrity":"Every Claude request is still parsed or cache-read and globally deduplicated with identical maxima; all request tokens are grouped by the exact dimensions consumed downstream, and grouped pricing is used only when nanodollar additivity is proven, with a correctness-preserving fallback otherwise."}}
{"run":43,"commit":"6aa4c77","metric":22.047208,"metrics":{"live_recalc_ms":15.938334},"status":"discard","description":"perf: skip unused all-time summary and ranking materialization; micro-timings improved but end-to-end cold and warm recalc regressed","timestamp":1783888003265,"segment":16,"confidence":4.580788070315398,"asi":{"hypothesis":"All-time materializations only feed browser rows, so skipping their unused summaries and rankings should remove thousands of rounded cost updates without changing output.","correctness_evidence":"All 41 tests and backpressure checks passed, stable diagnostics reduced all-time materialization from about 1.03 ms to 0.48 ms, and the complete live payload matched HEAD exactly at a fixed clock.","result_interpretation":"Despite the isolated reduction, cold median regressed from the persisted 21.075 ms best to 22.047 ms (4.6%) and warm median regressed from 14.674 ms to 15.938 ms (8.6%).","rollback_reason":"The primary metric worsened materially and the secondary metric moved in the same direction, so the selective all-time materialization change is not retained.","next_action_hint":"Do not retry this internal materialization flag immediately; target measured cold-cache hydration or Codex cache-hit work with clearer end-to-end leverage.","benchmark_integrity":"The experiment retained every all-time browser row and changed only unused internal artifacts; no provider, date, or output field was omitted."}}
{"run":44,"commit":"6aa4c77","metric":20.046042,"metrics":{"live_recalc_ms":14.855333},"status":"keep","description":"perf: Hydrate compact cache entries directly\n\nPurpose: Reduce restart cache loading by avoiding legacy normalization work for current positional entries.\n\nIncludes:\n- hydrate compact Codex contributions and Claude request and attribution tuples directly\n- retain defensive dictionary normalization for backward-compatible legacy cache entries\n- preserve timestamp parsing, field fallbacks, file signatures, pricing keys, and contribution values\n- validate legacy equivalence, exact live payloads, all 41 tests, and autoresearch checks","timestamp":1783888276163,"segment":16,"confidence":4.45647470114486,"asi":{"hypothesis":"Current positional cache entries were normalized before serialization, so routing them through legacy per-field normalization on every restart is redundant; direct hydration should reduce cold load while leaving legacy dictionaries supported.","correctness_evidence":"Compact and reconstructed legacy entries hydrated to identical typed values, the complete live payload matched HEAD exactly at a fixed clock, and all 41 tests plus backpressure checks passed.","result_interpretation":"Cold median improved from the persisted 21.075 ms best to 20.046 ms (4.9%). Warm median measured 14.855 ms versus 14.674 ms, a small 1.2% shift consistent with variance because this change only affects first-process cache hydration.","benchmark_integrity":"The same cache file and every provider entry are still decoded; all source files retain per-recalc stat validation and Codex pricing-key validation. Only already-normalized compact fields bypass legacy string stripping and integer clamping."}}
